review_id,platform,country,date,star_rating,title,text,user_name,app_version,is_crypto
13886583508,app_store,ie,2026-03-25T13:13:03-07:00,5,Love it👍excellent,"Brilliant service great doing business, on Revolut",stevo dub,10.123,False
13886514010,app_store,ie,2026-03-25T12:46:23-07:00,5,👍,It’s a handy app and don’t ever have issues with it.,Geraveli The Don,10.122,False
13886506741,app_store,ie,2026-03-25T12:43:35-07:00,5,Thanks,I really like Revolut.,Irakligogola,10.119,False
13886458557,app_store,ie,2026-03-25T12:25:33-07:00,5,Better than the High Street,"Responsive and easy, compared to a traditional bank in Ireland anyway, that have all have had decades of underinvestment and taking customers for granted.",Sleepy headzzzzzzzzzzzzzzzzzzz,10.123,False
13886406739,app_store,ie,2026-03-25T12:06:08-07:00,5,The best bank and app ever,"I love it and use everyday, well done",Roman-m,10.122,False
13886223229,app_store,ie,2026-03-25T10:59:02-07:00,5,Very good,Very good no complaints,Euigne,10.123,False
13886017595,app_store,ie,2026-03-25T09:46:50-07:00,5,JT,Excellent,Jenjentoomey,10.123,False
13885925115,app_store,ie,2026-03-25T09:15:28-07:00,5,Love everything about it,Best bank we could possibly have in Ireland. Glad it exists,Amelitis,10.123,False
13885868550,app_store,ie,2026-03-25T08:56:33-07:00,5,Had a great Revo-service !,I love how it’s fast and secure loving it so far honestly and this is not a sponsored review.,Khu 🇲🇼,10.108,False
13885122565,app_store,ie,2026-03-25T04:46:48-07:00,5,Default payment app,I have been using Revolut since a few years now for both domestic and sometime international transfers. UI is a breeze and there are loads of investment options,MoAz86,10.123,False
13885077110,app_store,ie,2026-03-25T04:29:31-07:00,5,Freddie,Brilliant,Fregss,10.123,False
13884880140,app_store,ie,2026-03-25T03:05:54-07:00,5,Life changing.,Honestly the best app I have. I would be lost without Revolut.,Lawaaa,10.116,False
13884803172,app_store,ie,2026-03-25T02:29:22-07:00,5,Perfect,Perfect app .. perfect everything,Juanperoa,10.122,False
13884760141,app_store,ie,2026-03-25T02:07:58-07:00,5,Brilliant platform,5/5,Ankush0808,10.122,False
13884744650,app_store,ie,2026-03-25T01:59:58-07:00,5,Revolut industry pioneer,"Continually revising offerings, quick to respond on my tier of card. Most benefits useful. Clear and concise, great for under 18’s.",Bisquotti,10.116,False
13884714511,app_store,ie,2026-03-25T01:44:47-07:00,5,Convenient,I find Revolut so easy to transy money,Eb933,10.122,False
13884600490,app_store,ie,2026-03-25T00:45:58-07:00,5,A+,Great App very useful,Gawron188@,10.122,False
13884570649,app_store,ie,2026-03-25T00:30:11-07:00,5,Very good,The best!!!,Adi140268,10.122,False
13884051633,app_store,ie,2026-03-24T19:55:38-07:00,5,Thank you,It was unexpected and no words to explain it was a great help thank you so much,Sarasu sarita,10.116,False
13883873466,app_store,ie,2026-03-24T18:36:39-07:00,5,Will Gallagher,5 star,Will the roost,10.122,False
13883504661,app_store,ie,2026-03-24T16:00:52-07:00,5,Perfect!,I couldn’t be happier with how easy is to use it and all works within seconds. Thanks!,StrompolKar,10.122,False
13883295272,app_store,ie,2026-03-24T14:34:44-07:00,5,Awesome app,The best financial for my retail needs. Would love to see commercial/ mortgage services,Mirax_O,10.122,False
13883135098,app_store,ie,2026-03-24T13:31:02-07:00,5,Efficiency per excellence,"Fast, seamless process and reliable transaction",Noel Dogoesekie,10.122,False
13883042754,app_store,ie,2026-03-24T12:55:24-07:00,1,Hidden Fees and Unresolved Support Issues,"I’ve been a Revolut customer for over 5 years, but this is the first time I’ve felt so disappointed. I was charged unexpected fees after a single €100 withdrawal in January. I understood there might be a fee for withdrawing cash on credit, but nowhere did Revolut show or explain how much interest would apply. Then came random charges of €6.80 in February and €9.24 in March with no clear reason.
When I contacted support, I got conflicting responses, one said I set up an instalment plan (I didn’t), another said I didn’t pay my statement (untrue, I have automatic payments). After several chats, no one could clearly explain the charges.
Revolut needs more transparency and reliable customer service. Taking money from long-time customers without clear justification is unacceptable.",Wcbelolli,10.122,False
13882978500,app_store,ie,2026-03-24T12:31:07-07:00,5,Excellent,Best bank account Ive ever had,V0983,10.116,False
13882579875,app_store,ie,2026-03-24T10:05:29-07:00,5,Working,Excellent,Excelente distracción,10.122,False
13882262923,app_store,ie,2026-03-24T08:16:43-07:00,5,Super,Ok,Daniel rata,10.122,False
13882114345,app_store,ie,2026-03-24T07:27:11-07:00,5,Good stuff,The international option is everything,ouncho,10.122,False
13882021179,app_store,ie,2026-03-24T06:56:11-07:00,5,Love Revolut,"Great banking, awesome options and easy way to get payments",I Do89,10.122,False
13881672277,app_store,ie,2026-03-24T04:54:19-07:00,5,Amazing,After a week of getting used to it’s a breeze. Cannot imagine how other banks and money providers don’t use this way of dealing with app development and ease of use.,DevilsMedyk,10.122,False
13881406925,app_store,ie,2026-03-24T03:04:18-07:00,5,Review,"Loving the app, makes my life so easy.",houdi_07,10.122,False
13881273118,app_store,ie,2026-03-24T01:59:07-07:00,5,Instant payments!,Nothing is faster! Could not live without Revolut!,BoldDonna,10.122,False
13881213228,app_store,ie,2026-03-24T01:28:03-07:00,5,Great help,"Always friendly user and  great helpful for everything 
Thanks",prashu07,10.122,False
13881172278,app_store,ie,2026-03-24T01:06:20-07:00,5,Great,Perfect,MissCB_,10.122,False
13881072326,app_store,ie,2026-03-24T00:11:36-07:00,5,Love it,Five star,Koochykooh,10.122,False
13880985553,app_store,ie,2026-03-23T23:22:10-07:00,5,Class,Easy use and navigate app,Westwoodabc,10.122,False
13880960483,app_store,ie,2026-03-23T23:07:48-07:00,5,"Easy to use, reliable","Love having the instant pay option, easy to use interface, have recommended to others.",Adders13,10.122,False
13880104244,app_store,ie,2026-03-23T16:15:21-07:00,5,Perfect bank and app,Perfect!,Philippe perel,10.122,False
13880055286,app_store,ie,2026-03-23T15:54:25-07:00,5,ASIRi Dampage Don,Great App,Smith999999,10.122,False
13879548726,app_store,ie,2026-03-23T12:31:03-07:00,4,Review,"Good app, quick and fast",Shano2308,10.122,False
13879513565,app_store,ie,2026-03-23T12:17:42-07:00,5,Great,Great,willo1979,10.121,False
13879384096,app_store,ie,2026-03-23T11:29:21-07:00,5,Enjoy using it,I had Revolut a few years ago & then stopped using it. I only came back to using it lately & I find that it’s more easy to use then banking with my own bank. Im a happy customer,Tulip girlie,10.122,False
13964805520,app_store,us,2026-04-16T11:43:51-07:00,5,My fav app,Better than Zelle and way easier than any bank app ever! Not hyperbole try it yourself!,charlie yankee 14,10.125,False
13964164669,app_store,us,2026-04-16T07:56:30-07:00,1,Poor Customer Service and Fee Farming,"It took almost 5 business days for a simple bank transfer to deposit in the account and to get it “instantly” you are paying a ludicrous fee. Additionally, good luck if you ever have a dispute. Almost entirely a chatbot and all it does is point you to file a police report no matter how small the transaction is. There are far better options out there and I highly suggest an alternative.",Ex_Banker,10.125,False
13963796843,app_store,us,2026-04-16T05:55:54-07:00,5,Mr,Very satisfied,alener29,10.125,False
13963518687,app_store,us,2026-04-16T04:15:47-07:00,5,The best,If you want nothing but the best… go with Revolut. I’m loving it,Judge Dred,10.125,False
13963121537,app_store,us,2026-04-16T01:07:32-07:00,5,Adoro,Adoro,Saenz333,10.125,False
13962652290,app_store,us,2026-04-15T20:56:24-07:00,5,Good service but expensive aCH price,ACH payments are overpriced. Cost .15 and you charge a multiple of that.,jh2310,10.125,False
13962498506,app_store,us,2026-04-15T19:39:57-07:00,5,Love it,"Have been using Revolut for a few years now. I love all its features! From checking account, exchange currencies, and easy transactions whether is shopping or wiring to other accounts. I love that I can create my own savings account at a very good rate, and that it is very safe, verifying transactions for new recipients instantly! Definitely recommend!",StellaDr,10.125,True
13962244436,app_store,us,2026-04-15T17:46:42-07:00,4,"Perfect, almost perfect!","Revolut is tra parent, fair, fast, easy to use. Gray areas: offer a loan that is always declined;it seems a trap to collect info from clients than a real offer. I have metal plan including travel insurance that changed from Allianz to unknown unreliable third part insurance.",viciobkk,10.125,False
13961741557,app_store,us,2026-04-15T14:04:40-07:00,5,Highly recommend Revolut.,"I’ve been using Revolut now for five years, I highly recommend it. It is an essential travel tool, with multi currencies, great exchange rates , more secure than my credit cards, easy to use, save, and send money to others across continents.",from grand cayman,10.125,True
13961732660,app_store,us,2026-04-15T14:00:56-07:00,5,Muito bom,Não tenho,Muito porreira,10.125,False
13961677075,app_store,us,2026-04-15T13:37:28-07:00,1,Waste of time / dysfunctional app,"Knowing this company is crypto friendly, I figured I would give them a shot. I didn't realize how low quality the company is. Their app is complete trash. Why they force you to go through that to initially start your account, instead of allowing you to go through the website, is beyond me

He can only verify certain types of IDs. For anyone else that lives in Florida, don't waste your time. It can't verify a Florida ID. I wasted my time trying to submit mine and eight different freaking times. Every single time, it rejected it.

If they are going to require an ID like that, they should have all ideas from all states in their system!!! for them to not do so is not only extremely irresponsible, but also a real easy way to take off a potential customer and get a negative review like this. And I have seen multiple other people complain about it not being able to read their IDs, so I am sure it is not only Florida drivers licenses that they have issues with

In case that wasn't bad enough, I couldn't even log into my account normally, because despite the fact that I know very well exactly what password I put into their system, their system somehow took in the wrong password!!! I knew exactly what password I put in, but yet it would repeatedly tell me that it was the wrong password!!!  and their ""password Recovery"" is completely worthless as well

Their app is trash, it's sloppy, it's incomplete, and with all of that said, I would not trust this company at all whatsoever. They are clearly slopped together. Then to make it worse, their customer service is pretty much nonexistent, no fraud department, you are pretty much just left to fend for yourself when it comes to this account.

Find an alternative. This one isn't worth the hassle.",Ascendant ;),10.125,True
13961483773,app_store,us,2026-04-15T12:22:20-07:00,1,Hard to login,Want to hear an oxymoron?  Leading British tech app.  The hours I’ve spent trying to login?  Forget this lousy interface and use brick and mortar banks who are shockingly more user friendly.,AndrewBNairobi,10.125,False
13961407461,app_store,us,2026-04-15T11:54:07-07:00,5,Awesome banking experience,This app beats every other bank,sergioferras,10.125,False
13961334258,app_store,us,2026-04-15T11:27:33-07:00,5,Amazing,Highly reliable when it comes to sending international transfers fast. I also love the conversation rates and hassle free transactions,logicofwar,10.125,False
13961128116,app_store,us,2026-04-15T10:14:00-07:00,5,Strongly recommend,"Amazing interface, easy to use and great customer service. Strongly recommend",Guillaume A.P.,10.125,False
13960605838,app_store,us,2026-04-15T07:17:47-07:00,5,Perfect banking,It’s so sad that revolute is closed in Ukraine,Juleila83,10.125,False
13959663177,app_store,us,2026-04-15T00:58:37-07:00,5,Leonid Nevzlin,The best online banking ever,Levnev210959@,10.125,False
13957987156,app_store,us,2026-04-14T12:00:14-07:00,5,El futuro,Un banco y una herramienta increíble que facilita todo.,ElBobby,10.125,False
13956827773,app_store,us,2026-04-14T05:21:03-07:00,5,Opinion,Cest bien honnêtement tres bien rien a dire,Staycy Carty,10.125,False
13955161917,app_store,us,2026-04-13T16:12:27-07:00,5,Revolut’s Review,"Revolut is perfect, it’s convenient and extremely easy to use. I wish all banks had this system. It would make financing so much easier.",Duece_sxm,10.125,False
13954604511,app_store,us,2026-04-13T12:18:12-07:00,5,Excellent app,100% recommended,MSF021,10.125,False
13954517460,app_store,us,2026-04-13T11:45:33-07:00,5,Great,Works very well,fidus achates,10.125,False
13954358613,app_store,us,2026-04-13T10:48:07-07:00,5,Nice,Nice,Anass LOUKIL,10.125,False
13954331092,app_store,us,2026-04-13T10:38:17-07:00,5,Like European Venmo!,Love this international money app plus I use their high yield savings acct with 4% interest with no minimums. Easy to transfer various currencies too.,Sydney Simnitt,10.125,False
13953599659,app_store,us,2026-04-13T06:30:09-07:00,5,The Best Fintech Application,"I’ve used a lot of Fintechs and this one is the best hands down. Fast transfers, smooth interface, plenty of banking features. I LOVE this app and everything it offers and will continue to develop to.",CV246,10.125,False
13953342674,app_store,us,2026-04-13T05:00:51-07:00,5,Thanks,Thank you for the good service,yazandal,10.124,False
13950805171,app_store,us,2026-04-12T10:12:53-07:00,4,Saved me,Revolut has solved my money exchange and spending problems. I moved to the Czech Republic and couldn’t open a bank account so had to pay an international fee every time I had to get cash or pay for anything. Revolut lets me transfer money from my banking account in America and buy Czech crowns at good prices.,Rufus Lee Kirkland,10.124,True
13950670535,app_store,us,2026-04-12T09:29:35-07:00,5,Next-Gen Banking,"Revolut makes managing money super easy. Transfers are instant, exchange rates are great, and I can keep all my currencies in one place. The app looks great, runs fast, and the budgeting tools are super handy.

I use it every day — honestly can’t imagine going back to a regular bank.",TheRomero,10.124,True
13950484330,app_store,us,2026-04-12T08:30:51-07:00,5,Good,"Very nice app easy to use, help to investing my money and increase them.

 Muy accesible y me ayuda a invertir y generar ganancia.",Noe29&&,10.124,False
13950424614,app_store,us,2026-04-12T08:12:27-07:00,2,Nice app but….,"I like how this app works everything about it is great, I only have 2 dislikes and that is…..
1. Every time you add money to your Revolut card you get charged a transfer fee 
2.  Now this one I did not know but for some reason they give you a weekly limit when you add money to your Revolut card, once you reach that you won’t be able to add funds to your Revolut card I believe it’s a 7 day cooldown time",Traka57,10.124,False
13950271437,app_store,us,2026-04-12T07:25:19-07:00,5,Revolut,Super bien 👏👍,Kafrine974sa,10.124,False
13948927306,app_store,us,2026-04-11T22:11:03-07:00,4,Buena app,Hasta ahora me está dando un excelente servicio,Humberto1233,10.124,False
13948752855,app_store,us,2026-04-11T20:47:48-07:00,5,The best bank I ever used,"I travelling between USA and Ukraine everytime, making transfers between these two countries. Is the best bank I ever used. Thanks!",LBenav,10.124,False
13948384803,app_store,us,2026-04-11T18:10:14-07:00,5,Very good bank,"Please, be a bank in United States",MosaicoJT,10.124,False
13947204205,app_store,us,2026-04-11T10:20:48-07:00,5,Life Changing app,"My kids live abroad and I’m able to send them money instantly, easy international bank transfers. This app has honestly changed my life for the better.",low and high brow mix,10.124,False
13947162661,app_store,us,2026-04-11T10:07:08-07:00,5,Best banking app,"Well ahead of most banks, app works great and haven’t needed human help ever!",NNJO74,10.124,False
13946794980,app_store,us,2026-04-11T08:12:25-07:00,5,Easy to use,I love Revolut for how easy it is to make transfer and use for international payments while traveling. Great bank!,Axelle P.,10.124,False
13945897479,app_store,us,2026-04-11T03:04:18-07:00,5,"la banca facil, práctica y abierta","Revolut me ha impresionado positivamente por su sencillez de las operaciones, claridad del manejo, muy buena app. en fin, es manejar la  banca facil, práctica y abierta",diegodelavega,10.124,False
13944408987,app_store,us,2026-04-10T15:55:39-07:00,5,Leo,A good app.. easy to navigate,leotobzy,10.124,False
13944209375,app_store,us,2026-04-10T14:30:49-07:00,5,Muy bueno,Me ha funcionado excelente,Jluiscuevas,10.124,False
13944130812,app_store,us,2026-04-10T13:58:30-07:00,5,George M,Best App in her class,Geo moș,10.124,False
13944099840,app_store,us,2026-04-10T13:46:03-07:00,4,Great for traveling,"I have been using Revolut for a few years, I have the metal plan. It’s great because I get the beat rates for currency exchange just pulling money from foreign ATMs. 

Only down side is the limited flexibility for withdraws. You are limited to $4000 in 24 hour transactions. To get a increase to make big purchases isn’t guaranteed and takes time for them to approve it if they do. 

Other than that I have no issues. Get my paycheck early and easy transition country to country.",DQC07,10.124,True
13943535454,app_store,us,2026-04-10T10:16:05-07:00,5,Revolut,Wonderful app with so many great features.  multiple currencies.,black terrible,10.124,False
13943482586,app_store,us,2026-04-10T09:58:08-07:00,5,Nice !,"I have been using Revolut for several months now.  It takes a little while to get use to the app and how things work, specially when working with international transfers and money conversions.
But now that I understand how to use the app, I really like it.  I use the app quite often now and will be changing my work direct deposit soon as well.
I initially signed up for the free account and recently upgraded to the Metal account, which has a fee but in my case works for me.
I’d recommend it to people who manage US dollars and international money, it works great to have all the features in one single app.

Thanks Revolut! 👍🏻",Jayster69,10.124,False
13943380475,app_store,us,2026-04-10T09:23:59-07:00,5,Da gusto,Da gusto usar esta app es muy cómoda,Yooorujc,10.124,False
13943314360,app_store,us,2026-04-10T09:02:18-07:00,5,Best FIN App ever,"I have been using Revolut since 2019. It has never upset me. Best rate, fare fees, fastest service. Thanks Revolut.",thomas toe,10.124,False
13943068247,app_store,us,2026-04-10T07:45:01-07:00,5,love it,good,Jfrm1804,10.124,False
13942438709,app_store,us,2026-04-10T04:15:57-07:00,5,Luv it,Luv it,Buck3220.,10.124,False
13942404810,app_store,us,2026-04-10T04:02:55-07:00,1,Useless,This app sucks you can’t transfer any money into your account and even when you can with Apple Pay they charge you a fee,No live games,10.124,False
13942145549,app_store,us,2026-04-10T02:09:02-07:00,5,R,It’s the best,Berrish m,10.124,False
13941872999,app_store,us,2026-04-09T23:51:42-07:00,5,Great🤗,Awesome,😡ANGRY😡CUSTOMER😡,10.124,False
13940516140,app_store,us,2026-04-09T13:27:18-07:00,5,Simply the Best,Thank you very much …,Lou007Lou,10.124,False
13937907213,app_store,us,2026-04-08T20:20:40-07:00,4,Práctica rápida sencilla,Buena aplicación,Tazhiby,10.124,False
13937564480,app_store,us,2026-04-08T17:50:19-07:00,5,Reliable and efficient banking app,"Revolut offers a smooth and efficient experience for managing finances. Transfers are fast, the interface is user-friendly, and the features are very practical for daily use and international transactions. Highly recommended.",M.Sologhani,10.124,False
13937554722,app_store,us,2026-04-08T17:46:19-07:00,5,A good app that is fast and convenient,I like it very much,youngrd816,10.124,False
13937423016,app_store,us,2026-04-08T16:50:16-07:00,1,Brighteyes,"Difficult to use and cancel - I tried numerous times to cancel following directions and unable to cancel no ongoing
Payments; have balance of $1.04 from my linked bank account and could not get it transferred back to my account! Just want it cancelled and can’t do not recommend!",Pug Ley,10.124,False
13937266623,app_store,us,2026-04-08T15:44:01-07:00,5,Muy sencillo y eficiente,El banco perfecto que es sencillo y seguro,diego lopez hombre,10.124,False
13936057238,app_store,us,2026-04-08T08:15:41-07:00,5,User since pandemic era,I’ve been using Revolut since the pandemic and it is good if you have international family/friends/business. Good savings account and good security features.,jf07305,10.124,False
13935669040,app_store,us,2026-04-08T06:11:57-07:00,5,Speed of light,"I love Revolut. 
I feel that is super fast easy to use, clear and detailed.
Never had a single problem from a while.",Pigyios,10.123,False
13934331542,app_store,us,2026-04-07T20:10:40-07:00,5,Business owner and consultant.,Revolut is everything they claim to be. It’s been a first-rate experience and I highly recommend doing business with them.,Take Care of the Little Things,10.123,False
13933574664,app_store,us,2026-04-07T14:36:50-07:00,5,So easy,It’s so easy and convenient…I love  using revolut.,Uche ogoh,10.123,False
13932791838,app_store,us,2026-04-07T09:43:01-07:00,1,Worst bank on planet- even not a bank.,"Revolut made many features working smooth and fast. Before they start the verification of any operation, even if you bought bottle of water. They  block almost all function and you start to wait days and weeks with no possibility to contact anybody from the bank. NEVER USE THIS BANK SERIOUSLY",Dmitry Solopov,10.124,False
13931892671,app_store,us,2026-04-07T04:42:28-07:00,4,Very convenient and easy to use,"I’ve had a great experience using Revolut. It’s very user-friendly and makes sending and managing money quick and stress-free. I especially like the features and how everything is organized. A few improvements could be made, but overall I’m very satisfied.",Loveangel2961,10.124,False
13931781299,app_store,us,2026-04-07T03:59:01-07:00,5,Ottima,Comoda,LeoMastellaro,10.124,False
13931583318,app_store,us,2026-04-07T02:29:10-07:00,5,Best Banking Ever,It is the best banking service and app I ever had,TeoGrillo,10.124,False
13931309561,app_store,us,2026-04-07T00:07:31-07:00,5,Easiest to use.,Best of bests. Nothing compares to how easy it is to use banking. At last,Swingabi,10.124,False
13931291642,app_store,us,2026-04-06T23:58:04-07:00,5,Love Revolut,They are fantastic,Tats ne d,10.123,False
13930158803,app_store,us,2026-04-06T15:05:43-07:00,4,Convenient,Easy to send Manuel when you need it :),2spicy4u2,10.124,False
13930085517,app_store,us,2026-04-06T14:34:10-07:00,5,Único,Siempre la mejor opción,CeciFrank,10.124,False
13929934843,app_store,us,2026-04-06T13:32:19-07:00,5,Excellent,Excellent& efficient,Seliya33,10.123,False
13929837036,app_store,us,2026-04-06T12:53:57-07:00,5,"Fast, safe and easy 😍",Great platform 👍🏻,Lutxo_1011,10.124,False
13929520278,app_store,us,2026-04-06T10:59:15-07:00,5,Mr Diran Olojo,Solid financial services experience. Always seamless,Diran Olojo,10.124,False
13929486510,app_store,us,2026-04-06T10:47:21-07:00,5,Great app,Great app!!!,Dido 84,10.124,False
13929054827,app_store,us,2026-04-06T08:24:05-07:00,5,best,best ever,roumen77,10.124,False
13928826799,app_store,us,2026-04-06T07:11:50-07:00,5,Top,Very well,Vida Sol,10.123,False
13927826153,app_store,us,2026-04-06T00:29:24-07:00,5,Woody,Brilliant… don’t even think about it. Click & Download,jameswoodofyork,10.124,False
13927430413,app_store,us,2026-04-05T21:08:26-07:00,5,Excelente,Gracias por Existir un Banco Justo y que pueda Ser Utilizado Por Todos sin Importar su Nivel De Adquisición AMEN,MELQUISEDEC-H7,10.123,False
13925506741,app_store,us,2026-04-05T08:16:41-07:00,5,No.1 Bank,Revolut reinvented banking. Simple banking and transactions with low fees. I hope it stays this way.,BibiZg,10.114,False
13924050649,app_store,us,2026-04-04T22:21:52-07:00,5,👍,Easy to use. Love it,Hejdic,10.124,False
13922114047,app_store,us,2026-04-04T09:13:15-07:00,5,Gracias,Muy bien,Yetli32,10.124,False
13921610957,app_store,us,2026-04-04T06:40:02-07:00,5,Awesome online banking,Very great app,NoteG1,10.124,False
13921496435,app_store,us,2026-04-04T06:03:45-07:00,5,Good app,Trusted and reliable,Max21133,10.124,False
13921033960,app_store,us,2026-04-04T03:09:04-07:00,5,Лучшие,Очень удобное приложение.,Joll777,10.124,False
13920663283,app_store,us,2026-04-04T00:23:01-07:00,5,Best Money management app,App is smooth and service they provide is greatly appreciated,Deabi,10.122,False
13920572151,app_store,us,2026-04-03T23:40:55-07:00,5,Security conscious,Very high security with good offers,Tickatron,10.123,False
13918909767,app_store,us,2026-04-03T11:57:45-07:00,5,Amazingly easy to use,This really is N awesome app,Clairepreen,10.124,False
