review_id,platform,country,date,star_rating,title,text,user_name,app_version,is_crypto
13914306090,app_store,es,2026-04-02T06:42:34-07:00,5,Top ⭐️⭐️⭐️🌟🌟,"⭐⭐⭐⭐⭐  

Revolut es, para mí, el mejor banco online 💳✨  
Las transferencias son rápidas, fáciles y muy seguras. La aplicación es muy sencilla de usar y todo es claro.  

Mi único problema es que no puedo usarla para pagar la seguridad social como autónomo.  

Por lo demás, todo perfecto — servicio top 👌🔥",SalahXP,10.124,False
13914280357,app_store,es,2026-04-02T06:34:32-07:00,5,Excelente,Excelente,Cduran21,10.124,False
13914239040,app_store,es,2026-04-02T06:21:17-07:00,5,Excellent,Best banking app ever tried,p4463,10.123,False
13914164555,app_store,es,2026-04-02T05:57:10-07:00,5,Me encanta,Las transfer a Caixa son inmediatas. Todo funciona genial,Sofíaccciii,10.122,False
13914092143,app_store,es,2026-04-02T05:33:03-07:00,5,El mejor banco,"El mejor que he visto, lo recomiendo muchísimo",Oscargc.,10.123,False
13914076049,app_store,es,2026-04-02T05:27:36-07:00,5,Facilidad y comodidad,Me gusta mucho la facilidad de poder realizar operaciones y la comodidad que aporta la app de Revolut. Además de las transferencias sin coste y otros servicios muy útiles,Raúl sanz calma,10.124,False
13914056617,app_store,es,2026-04-02T05:20:57-07:00,5,Práctica,No cobra por tener cuentas y es muy intuitiva. Siempre la recomiendo,Abeldma13,10.124,False
13913739575,app_store,es,2026-04-02T03:19:56-07:00,3,"Gran banco, buena app","Me gusta, y te dan intereses, y cuando pagas te llegan los avisos muy rápido y claro.",Ionecccccc,10.123,False
13913655579,app_store,es,2026-04-02T02:42:47-07:00,5,Best financial app ever,Love it,mmm__s98,10.121,False
13913642575,app_store,es,2026-04-02T02:36:48-07:00,5,Fácil e intuitivo,Hace mi vida más fácil . Gracias,Atrapaisimo,10.124,False
13913642567,app_store,es,2026-04-02T02:36:47-07:00,5,Me encanta,Simplemente contenta y feliz con este banco,Abreu Lopes,10.124,False
13913623837,app_store,es,2026-04-02T02:28:07-07:00,5,Excelente,Excelente,EldiegoLT,10.124,False
13913518756,app_store,es,2026-04-02T01:38:10-07:00,5,♥️,GRACIAS,R♥️Y,10.119,False
13913501228,app_store,es,2026-04-02T01:29:42-07:00,5,Great service,I've been using Revolut for a while now (3years). I am very satisfied with everything what that platform offers. Keep on a good job Revolut!,Alex Khr,10.124,False
13913452228,app_store,es,2026-04-02T01:05:41-07:00,5,Dinámico,"Muchas soluciones para el día a día, gran banco y muy buena la app.",Luis Motos,10.124,False
13913437693,app_store,es,2026-04-02T00:58:32-07:00,5,Highly recommended,I have had this account for over 8 years and never had any problem and works well all over the world.,Tonicheee,10.124,False
13913354772,app_store,es,2026-04-02T00:17:46-07:00,5,Great banking app,This is one of the most effective banking app I have ever used. Highly recommended!,iamoloaps,10.123,False
13913322125,app_store,es,2026-04-02T00:01:38-07:00,5,El mejor bancos,"Mejor banco del mundo, porque es muy rápido las traslaciones y también podemos invertir en las bolsas de valores!",alias suzy,10.123.1,False
13913284409,app_store,es,2026-04-01T23:42:43-07:00,5,Perfecta,"Fácil, intuitivo, ágil, ninguna queja.",AnMusic,10.113,False
13913278676,app_store,es,2026-04-01T23:39:54-07:00,5,Perfecto,10,Chiutuflo,10.123.1,False
13913260734,app_store,es,2026-04-01T23:30:51-07:00,5,Estupendo banco,Tiene muchos beneficios y es súper cómodo. Para pagar en el extranjero funciona genial sin comisiones al cambio de moneda,andiie7,10.114,False
13913058019,app_store,es,2026-04-01T21:47:36-07:00,5,Easy,The app is very easy to understand and user friendly.,marcomgcal,10.123.1,False
13913010050,app_store,es,2026-04-01T21:23:43-07:00,5,Increíble,Me parece una pasada esta cuenta de Revolut,Silvinaargentina,10.123,False
13912659701,app_store,es,2026-04-01T18:44:42-07:00,5,Gran aplicación bancaria,Perfecto en su resolución,josue5008,10.123,False
13912422623,app_store,es,2026-04-01T17:06:23-07:00,1,No es segura,Da datos a bancos y entidades españolas yo personal me te e perdido más de 3000€ ice la cuenta pensando que era algo bueno y es como cualkier cuenta española.,@jgomezcortes88,10.123.1,False
13912411209,app_store,es,2026-04-01T17:01:33-07:00,5,Excelente aplicación,No me canso de recomendar a Revolut. El mejor servicio bancario que he tenido.,Delriopeduzzi,10.123,False
13912395436,app_store,es,2026-04-01T16:54:45-07:00,5,Me encantan,Excelente,Juan Marín vzla,10.122,False
13912209303,app_store,es,2026-04-01T15:34:41-07:00,5,Mejores prestaciones .,"Creo que se podrían mejorar las condiciones para los que tenemos cierto saldo en cuenta, nómina, recibos, etc.

Tales como ofrecerle una mejora en tarjeta, mayor cashback, etc.

Saludos",Felixra,10.123,False
13912145791,app_store,es,2026-04-01T15:07:43-07:00,5,Muy util,Un buen funcionamiento,JCL1924,10.123.1,False
13912103864,app_store,es,2026-04-01T14:49:52-07:00,5,Encantada.,Increíble.,Euge8796,10.123.1,False
13912085037,app_store,es,2026-04-01T14:42:01-07:00,5,Revolut lo mejor,Simplemente sencillo,Tomas15,10.123.1,False
13912076433,app_store,es,2026-04-01T14:38:27-07:00,5,Mejor Neobanco,Es súper eficaz y rápido.,JuliánSaxo,10.123.1,False
13912022099,app_store,es,2026-04-01T14:16:00-07:00,5,Excelente,"Funciona perfectamente, transferencias inmediatas y comodidad en los pagos. Recomendable!",Indira003,10.123,False
13911945532,app_store,es,2026-04-01T13:45:09-07:00,5,Best neobank ever,It literally changed how good I can manadge my wellness,Pelopo96,10.123.1,False
13911758861,app_store,es,2026-04-01T12:33:36-07:00,5,Excelente en todo,"Un banco ideal para viajar pero no solo para eso, es bueno para los gastos de cada día así como para ahorrar e invertir en múltiples activos. Su app es realmente fácil de usar, rápida y fiable.",Pablo M2,10.123.1,False
13911686174,app_store,es,2026-04-01T12:06:54-07:00,5,👍🏼,Very good APP!,Txivit,10.123,False
13911578238,app_store,es,2026-04-01T11:28:12-07:00,5,Amazing Best Ever,I love Revolut. The app is simple and intuitive. My finances make more sense and everything is easier to follow.,Icultural Spain,10.123.1,False
13911472116,app_store,es,2026-04-01T10:50:55-07:00,5,Muy contento,La verdad que una app muy facil de usar,Edgar17111,10.123.1,False
13911395834,app_store,es,2026-04-01T10:24:47-07:00,5,El mejor banco para inversiones,"Tengo de todo materias primas, como oro, letras del tesoro y por supuesto acciones.

1000% recomendable. Aunque los intereses de prestamos Y demás no son muy competitivos.",Arturo gomez,10.123.1,False
13911327817,app_store,es,2026-04-01T10:01:51-07:00,5,El mejor,Me encanta Revolut,Liliana Turizzo,10.123.1,False
13911307063,app_store,es,2026-04-01T09:55:01-07:00,5,Extraordinaria,"Me encanta la facilidad con lo que puedes usar. Esta aplicación tiene una gran diversidad de opciones para invertir, enviar dinero, recibirlo e etc. maravillosa me encanta",Okeaye,10.123.1,False
13911284238,app_store,es,2026-04-01T09:47:26-07:00,5,Muyy organizada e intuitiva,Es la mejor,whoisjhonny,10.123,False
13911217142,app_store,es,2026-04-01T09:25:26-07:00,5,Genial,Super,jorge E B,10.123.1,False
13911052094,app_store,es,2026-04-01T08:33:05-07:00,5,muy bien,me dice a la hora que se ha echo bizum,patrycalituro,10.123,False
13911050877,app_store,es,2026-04-01T08:32:43-07:00,5,Revolut,Muy bien,Fido titerito yuka,10.123.1,False
13910983794,app_store,es,2026-04-01T08:12:02-07:00,5,El mejor,"Muy fácil, rápido y eficaz",736292,10.123.1,False
13910914053,app_store,es,2026-04-01T07:50:52-07:00,5,Buen banco,Un banco que no te falla 😉,Escarlata 77,10.123,False
13910865287,app_store,es,2026-04-01T07:36:07-07:00,5,Mi Banco de Referencia,La mejor aplicación de Finanzas para tus ahorros,Isaac_Hero,10.123.1,False
13910813610,app_store,es,2026-04-01T07:20:35-07:00,1,Cobran por todo,"Hace años que uso la app, y cada vez cobran por mas cosas. Antes no cobraban comision por cambio de divisa, ahora fines de semana si y max 2000€ al mes. Daban prueba gratuita de metal, tampoco es mi banco habitual, no la utilize y se me olvido cancelar. Acepto el error y pagar este mes, pero ahora por cancelar antes de 6 meses inciales te cobran por cancelar dos meses del plan? A parte del que ya he pagado por despiste? 
100% dejare de usarla.",Berta Carbonell,10.123.1,False
13910750173,app_store,es,2026-04-01T07:01:30-07:00,5,Muy bueno,Fácil de usar y seguro,Jaz_alcaraz,10.123.1,False
13910742479,app_store,es,2026-04-01T06:59:11-07:00,5,10/10,Me encanta,CondeGsus,10.123.1,False
13910734979,app_store,es,2026-04-01T06:56:56-07:00,5,Genial,"Muy funcional, sin trámites engorrosos y fácil de usar",Jossalg,10.123.1,False
13910651262,app_store,es,2026-04-01T06:31:25-07:00,5,The best,The best,Totorfl,10.123.1,False
13910577737,app_store,es,2026-04-01T06:08:40-07:00,5,Excelente,"Muy buena aplicación, muy práctica y fácil de usar me ha gustado mucho",Cristian Holguín,10.123,False
13910565663,app_store,es,2026-04-01T06:04:54-07:00,2,Català i interessos,L’app no esta en Català i els interessos que oferiu son molt baixos,Holaaa23,10.123.1,False
13910555913,app_store,es,2026-04-01T06:01:54-07:00,5,Es una maravilla,Para mí el mejor banco que hay si es verdad que nos facilitarían la vida poniendo cajeros en Canarias para poder ingresar dinero en nuestra cuenta,Edgar0410,10.123.1,False
13910537411,app_store,es,2026-04-01T05:56:07-07:00,5,The best,Muy bien,Yuliussss,10.123.1,False
13910377625,app_store,es,2026-04-01T05:04:26-07:00,5,INCREDIBLE BANK!,It’s perfect,vitor mascia,10.123,False
13910297985,app_store,es,2026-04-01T04:37:04-07:00,5,Cuenta principal,Recomendable 100%,repuestos FDR,10.123,False
13910222172,app_store,es,2026-04-01T04:09:32-07:00,5,Revolut,"Facil de usar y sobretodo segura. Mi experiencia ha sido muy positiva con cobros fraudulentos y me han devuelto el
Dinero casi de manera instantánea.",susoal,10.123.1,False
13910189022,app_store,es,2026-04-01T03:57:04-07:00,5,Good,Revolut is good to use,joki chick,10.121,False
13910145781,app_store,es,2026-04-01T03:40:09-07:00,5,Muy buena,Me encanta mejor que los bancos tradicionales.,IsmaelRV.,10.123.1,False
13910137132,app_store,es,2026-04-01T03:36:41-07:00,5,Genial!!!,Una App fácil de trabajar y muy práctca !,Barcelona1,10.123.1,False
13910074275,app_store,es,2026-04-01T03:10:44-07:00,5,Buen banco online,"Rápido y ágil en las transacciones, sin comisiones y los mejores cambios de moneda",Mario Gracia,10.121,False
13910017831,app_store,es,2026-04-01T02:46:12-07:00,5,Bien,Todo funciona muy bien no me puedo quejar …,Ottolu,10.123.1,False
13909985833,app_store,es,2026-04-01T02:31:56-07:00,5,Excelente,Excelente,Kleber_Santos67,10.123.1,False
13909981493,app_store,es,2026-04-01T02:29:55-07:00,5,Confío al 100%,"Muy eficaz, rápido y seguro. Me encanta!",mafioturock,10.123,False
13909894538,app_store,es,2026-04-01T01:49:20-07:00,5,Me encanta,solo faltaria poder ingresar efectivo ✅,jmedtdscis,10.123,False
13909879141,app_store,es,2026-04-01T01:42:03-07:00,5,Great banking app,"Works always, super easy to use and nice. Just excellent",argentino indignado,10.123.1,False
13909860295,app_store,es,2026-04-01T01:33:03-07:00,5,Buena banca internacional,"Me gusta, la recomiendo",_harold2,10.123.1,False
13909776910,app_store,es,2026-04-01T00:53:12-07:00,5,Es lo máximo,"Todavía no he usado todos los beneficios, pero como web me encanta es bastante intuitiva",vogisand,10.123,False
13909643255,app_store,es,2026-03-31T23:48:29-07:00,5,Funciona muy bien,Me encanta como funciona. Y que todo sea online.,Unyven,10.123.1,False
13909616106,app_store,es,2026-03-31T23:35:35-07:00,5,Revolut el nº 1,Muy fácil y rápido para operar,AntonPardines,10.123,False
13909568281,app_store,es,2026-03-31T23:12:07-07:00,5,Óptimo,Muy rápido y fácil de usar.,MarianPlaz,10.123.1,False
13909566715,app_store,es,2026-03-31T23:11:22-07:00,5,Super,Super,Ewa 10,10.123.1,False
13909538062,app_store,es,2026-03-31T22:57:17-07:00,5,Muy buena,Flexibilidad y rapidez que no me dan otros bancos.,FranFerriFayos,10.123.1,False
13909479951,app_store,es,2026-03-31T22:28:28-07:00,5,Genial,Muy contenta,Genial 👏👍,10.123,False
13909441288,app_store,es,2026-03-31T22:09:56-07:00,5,Super buen banco,Excelente,dani335,10.123.1,False
13909429092,app_store,es,2026-03-31T22:04:13-07:00,5,The best finance app,"Everything on Revolut works perfectly, there is no comparison with other apps or services",estows,10.123.1,False
13909425552,app_store,es,2026-03-31T22:02:33-07:00,5,10/10 Ibai,Ibai ayúdame con la boda,chemamoranvera,10.123.1,False
13909420121,app_store,es,2026-03-31T21:59:56-07:00,5,Excelente Banco,Es muy versátil y con una interfaz espectacular,Juan Carlos4,10.123,False
13963965114,app_store,nl,2026-04-16T06:51:30-07:00,5,Top,Werkt goed,Petervriend,10.125,False
13963951607,app_store,nl,2026-04-16T06:47:07-07:00,5,Good app👍,I like the functionality of the app.,Karolsky82,10.125,False
13963300426,app_store,nl,2026-04-16T02:40:12-07:00,5,Good,Good job,Yuliia31t,10.125,False
13963157850,app_store,nl,2026-04-16T01:27:03-07:00,5,Recommend,$,andarol,10.125,False
13961322655,app_store,nl,2026-04-15T11:23:21-07:00,5,"Smooth, Fast, and Packed with Features","Very user-friendly app with lots of great features. The exchange rates are excellent, and everything works incredibly fast.",ivahmad,10.125,True
13961158751,app_store,nl,2026-04-15T10:24:50-07:00,5,Thumbs up,Love love it,:TKt,10.125,False
13961146589,app_store,nl,2026-04-15T10:20:30-07:00,1,Worthless application,"I am trying opening an account on my iPhone, latest iOS: it simply doesn’t work: it is slow, it has authentication problems. Indoor get it! help wanted!!
April 2026:
It is still not working: I am in the netherlands, I have the latest iOS version, cleaned out my cache, reinstalled this app, by default the app thinks that I am in Saudi arabia, which is not true.  I punch in my Dutch cel number, I receive a code, I enter the code and i get the message that revolut isn’t active in saudi arabia.?!?!?!? And there applying for an account halts. 

Pls resolve asap",Marty dutchy,10.125,True
13960933425,app_store,nl,2026-04-15T09:06:15-07:00,5,Amazing banking app,"Works great, no complaints",Kevinismus99,10.125,False
13959611323,app_store,nl,2026-04-15T00:30:49-07:00,5,Top !!,Top !!,MM_61,10.125,False
13959544267,app_store,nl,2026-04-14T23:55:07-07:00,5,Opinia na temat Revolut.,Daje 5 ponieważ jeszcze nigdy mnie nie zawiodł.,BrajanOflajr,10.125,False
13959539278,app_store,nl,2026-04-14T23:52:23-07:00,5,Easy use and perfect service,I like this app and Revolut as bank due to Easy use and perfect service,hmdfah,10.125,False
13959487174,app_store,nl,2026-04-14T23:24:27-07:00,5,Efficiënt,The most efficiënt and the best way of paying and saving from the app the most secure way to do youre payments,Seffaaal,10.125,False
13959305657,app_store,nl,2026-04-14T21:46:32-07:00,5,Top,Top,emmaquartel,10.125,False
13958374900,app_store,nl,2026-04-14T14:36:20-07:00,5,So good,So far so good,Quickdeath25,10.125,False
13958205113,app_store,nl,2026-04-14T13:24:22-07:00,5,Abdellah,Top top top,a.aitali,10.125,False
13958136311,app_store,nl,2026-04-14T12:57:19-07:00,5,Easy & Efficient,As an IT-Developer I can only appreciate the work that is being put into this application,Jim07031,10.125,False
13957914127,app_store,nl,2026-04-14T11:33:01-07:00,5,Great App,Best financial app i've used,Ahmad shabib,10.124,False
13957350458,app_store,nl,2026-04-14T08:15:12-07:00,5,Fast,It is working very well,anas ibrahem,10.125,False
13957338542,app_store,nl,2026-04-14T08:11:17-07:00,5,Best banking ever,"Absolutely love it! No transition fees, great points saving program where you can purchase gifts vouchers or miles with! Better saving accounts than most banks … thanks team Revolut",Yvonntje,10.125,False
13957107223,app_store,nl,2026-04-14T06:55:52-07:00,5,Zachwycony,Super aplikacja bankowa,mag069,10.125,False
13956675705,app_store,nl,2026-04-14T04:25:00-07:00,4,Top app,Stukken overzichtelijker dan bunq,R. Kaput,10.125,False
13956321438,app_store,nl,2026-04-14T01:42:42-07:00,5,Fijne Bank,Makkelijk in gebruik!,oummiiieee,10.125,False
13955967912,app_store,nl,2026-04-13T22:32:15-07:00,5,Fijne bank,"Het was even puzzelen met hoe de app werkt, maar vind het een hele fijne bank. Transacties staan er duidelijk in en het is fijn dat andere valuta eventueel ook nog bij aangegeven worden als je in die valuta hebt betaald. 

Daarbij ook fijn met fraude-gevoeligheid, ze checken of de transactie klopt en blokkeren tot die tijd je rekening.",Lunamaan,10.125,False
13955883845,app_store,nl,2026-04-13T21:47:28-07:00,5,Tracker,I love R. I would love to see a expense tracker on the app.,Linxù,10.125,False
13954765367,app_store,nl,2026-04-13T13:21:11-07:00,5,Easy nice app,Toppiee,Lijahsts,10.125,False
13954424879,app_store,nl,2026-04-13T11:12:09-07:00,5,Leal,Es perfecto,kapinext,10.125,False
13954194618,app_store,nl,2026-04-13T09:49:00-07:00,5,Просто самый удобный вариант,Я восторге и очень доволен,Super respect,10.125,False
13953797640,app_store,nl,2026-04-13T07:34:47-07:00,5,Good,"I'm new and I adapt easily. I'm so young but a bit suspicious when I try something new, but I love it. It's easy to use and can be used in any language.",Analuisavdv,10.125,True
13953742316,app_store,nl,2026-04-13T07:16:58-07:00,5,tevreden gebruiker,"het gemak om zo vrij en snel te beschikken over je eigen geld stelt mij enorm tevreden. het gebruik van de app is makkelijk en snel. de stappen die worden genomen om fraude en verdachte transacties tegen te gaan is uitzonderlijk. Abn, ing, rabo lopen in vergelijking met revolut gigantisch achter.",Super revolut fan,10.125,False
13953447870,app_store,nl,2026-04-13T05:38:15-07:00,5,Beste bankapp,De app werkt gewoon hoe je hoop dat een app werkt. En je hebt een gratis creditcard dat is toch top!!,hutsieiegddfzbh,10.125,False
13952631220,app_store,nl,2026-04-12T23:22:12-07:00,5,Super,Is heel gemakkelijk in gebruik snel en werkt gewoon als een echte bank,Irian62,10.124,False
13952553452,app_store,nl,2026-04-12T22:38:53-07:00,5,Very good app,I like it,Fsy8818,10.124,False
13952429240,app_store,nl,2026-04-12T21:30:52-07:00,5,Fantastisch!!,Een 10 geef ik want alles is top en werkt heel makkelijk!,Schuimpie79,10.124,False
13951648643,app_store,nl,2026-04-12T15:27:49-07:00,5,JDJW,The best 💪🏽,Jack246,10.124,False
13951480956,app_store,nl,2026-04-12T14:16:42-07:00,5,Top app,Fijne UI/UX en functies,PLMATERS!!!!!!!,10.124,False
13951377956,app_store,nl,2026-04-12T13:35:12-07:00,5,General,"Revolut has clear, cheap and fast functionality",Magnify_98,10.124,False
13950984859,app_store,nl,2026-04-12T11:12:36-07:00,4,Top,Top,Haja..44..,10.124,False
13950896206,app_store,nl,2026-04-12T10:42:56-07:00,5,Best banking app,Best in Europa,Mojahed3li,10.124,False
13950737726,app_store,nl,2026-04-12T09:51:11-07:00,5,Good,Its very nice,88P8E8,10.124,False
13949884143,app_store,nl,2026-04-12T05:17:13-07:00,5,911,haha,gizlibalina,10.124,False
13949087894,app_store,nl,2026-04-11T23:28:44-07:00,5,Perfect!,Beter dan de andere banken!,mika61975,10.124,False
13947756002,app_store,nl,2026-04-11T13:40:29-07:00,5,Perfecto,"Fácil de instalar, utilizar y una app muy cómoda y eficaz. Me encanta.",HollandNLHoep,10.124,False
13947240411,app_store,nl,2026-04-11T10:32:46-07:00,5,It is a very good bank,The transfer is fast and they use different payment methods.,Hmalmir,10.124,True
13946354020,app_store,nl,2026-04-11T05:57:30-07:00,5,Swietny!,"Bardzo lubie korzystac z Revoluta, ma duzo fajnych i szybkich rozwiazan.",08Anna08,10.124,False
13945926866,app_store,nl,2026-04-11T03:17:04-07:00,5,Top,Super duidelijke fijne app!,Shané Veldkamp,10.124,False
13945287387,app_store,nl,2026-04-10T22:21:58-07:00,5,Tevreden,"Ben tevreden met Revolut. Mooie, moderne bankrekening. Zou alleen ook graag contant geld willen kunnen storten.",Viking Yann,10.124,False
13944567402,app_store,nl,2026-04-10T17:03:43-07:00,5,Perfect,Top,Binkuitlimburg,10.124,False
13944523719,app_store,nl,2026-04-10T16:44:54-07:00,5,Polecam!,Top top top!,TianoSS,10.124,False
13943181970,app_store,nl,2026-04-10T08:20:17-07:00,5,Pozytyw 100%,Korzystam od 2018 i jestem usatysfakcjonowany,mikistw,10.124,False
13941997488,app_store,nl,2026-04-10T00:55:52-07:00,5,Cool features,App is super responsive and easy to use. It looks good too!,Mewtttt,10.124,False
13940614781,app_store,nl,2026-04-09T14:07:15-07:00,5,Blij,Ik gebruik dagelijks werk goed,Ene neen,10.124,False
13940496610,app_store,nl,2026-04-09T13:19:35-07:00,5,nicesss,nice,baronnnm,10.124,False
13939920274,app_store,nl,2026-04-09T09:50:44-07:00,5,Beste bank ever!,Super handig voor crypto,BTC smart money,10.124,True
13939786940,app_store,nl,2026-04-09T09:07:08-07:00,5,Kwalitijd bank,Vertrouwbaar bank,Revo2026,10.124,False
13939115935,app_store,nl,2026-04-09T05:32:06-07:00,5,Reviews,Top bank,Apskis12,10.124,False
13939081068,app_store,nl,2026-04-09T05:20:20-07:00,5,Super,Łatwe w obsłudze konto i to że można w szybki sposób przewalutować pieniądze.,Groszek J,10.124,False
13938863319,app_store,nl,2026-04-09T04:01:56-07:00,4,Efficiency is key 🔑,Revolut makes international transactions extremely easy. The app is also very easy to use and if you have any questions the AI Bot for customer service works great! Definitely recommend :),뽀잉~~~,10.124,True
13938664966,app_store,nl,2026-04-09T02:38:57-07:00,5,Almost the best bank,"Only improvement points are: getting in touch with a real person when having issues, and offering mortgages and allowances",niconico86,10.124,False
13938344076,app_store,nl,2026-04-09T00:04:19-07:00,5,Super blij,Super handig app ben heelnte vreden,essiej1988,10.124,False
13938319469,app_store,nl,2026-04-08T23:51:43-07:00,5,Very good,From beginning till now I am happy with the service and I hope it will be continue.,vidau,10.124,False
13938312393,app_store,nl,2026-04-08T23:48:05-07:00,5,Great app,Great app,Hugo070,10.124,False
13936736148,app_store,nl,2026-04-08T12:10:11-07:00,5,Topcard,Super in gebruik,Rootje65,10.124,False
13935751885,app_store,nl,2026-04-08T06:38:38-07:00,5,Best bank and banking app,Revolut is the way to go it’s the bank of the future 💫🌟🌟🌟🌟💪🏾👏🏾,Ijs Creme,10.124,False
13935612268,app_store,nl,2026-04-08T05:53:12-07:00,5,Transferência,5 estrelas,Béria,10.124,False
13935023734,app_store,nl,2026-04-08T01:55:54-07:00,5,Leuke app,Top,Xeliec22,10.124,False
13934946586,app_store,nl,2026-04-08T01:17:17-07:00,5,Flexible banking,I love revolut and I never have any problems with receiving or sending money.,AnnaSimakova,10.124,False
13934901208,app_store,nl,2026-04-08T00:54:19-07:00,5,Easy transfer,Simple to use,Kuki*55,10.124,False
13932963024,app_store,nl,2026-04-07T10:42:31-07:00,5,Super,Ben er zo blij mee en scheelt zoveel geld t.o. van de amex kaart,Dick Drosten,10.122,False
13932841643,app_store,nl,2026-04-07T10:00:07-07:00,5,Great!,Works wonderful,_ramonamarian,10.124,False
13932620729,app_store,nl,2026-04-07T08:45:37-07:00,5,Metal card,So happy with it!,RobinDushi,10.124,False
13932255969,app_store,nl,2026-04-07T06:47:20-07:00,5,Perfect,Makkelijk bankieren,IwanSoek,10.124,False
13932051101,app_store,nl,2026-04-07T05:39:01-07:00,4,"Excellent, with room to improve","I have used a Revolut for about a year now, and it is by far the easiest, most robust and pleasurable e-banking app to use out of Lydia, Bunq, SG, Wise and Boursorama. The interface is clear, and the app is responsive. However, there are a few points that should be improved:
- Adding money to Vaults is not counted as an actual transaction, and so are not currently counted in the budget despite being labelled as such. This seems like an easy fix. 
- It is not possible to categorise transaction granularly. Example: a payment at a store where some of the items would be in one category and others would be in another can not be split as such. Only one category is possible, it would be great to be able to assign amounts to within a single transaction. 
- Related in this is the ability to assign a certain portion of a transaction to a category and exclude the rest. 
- References are not including when exporting statements. 

Cheers for the great service! Long live Revolut 🤗",mutik67,10.124,False
13932026170,app_store,nl,2026-04-07T05:30:24-07:00,5,Revolutionair,"Revolut is gemak, snel en betrouwbaar. Ik wil nooit meer anders.",Franktsky,10.124,False
13931651151,app_store,nl,2026-04-07T03:01:48-07:00,5,Rustig op vakantie,"Zeer blij met kaart en app van Revolute
Voordelig, veilig en snel",DutchVenice,10.124,False
13931435325,app_store,nl,2026-04-07T01:14:30-07:00,5,Well done Revolut,I really like Revolut app. I wish more apps were like this,Digital Mandrake,10.123,False
13931266169,app_store,nl,2026-04-06T23:44:22-07:00,5,Easy to use,"User friendly app functionalities, on time transactions, exchange is convenient in the app. Easy banking.",sp Csilla,10.123,True
13929976795,app_store,nl,2026-04-06T13:49:08-07:00,5,Najim,Prima bank!,Bolle072,10.119,False
13929457903,app_store,nl,2026-04-06T10:37:25-07:00,5,Great bank,Great,qsand2012,10.124,False
13928161380,app_store,nl,2026-04-06T03:07:33-07:00,5,The best card for international me,"The Revolut cards has saved me a lot of money changing between several foreign currencies, its easy to use.",HaDes55,10.124,False
13925270740,app_store,nl,2026-04-05T07:01:43-07:00,2,De worst bank,I wanted to open a new bank but i find a lot of problem with the system,Hiirane 123,10.124,False
13925113009,app_store,nl,2026-04-05T06:09:18-07:00,5,Transparant en comfortabel,"Heel betrouwbaar,met gemak bankzaken doen",Mevr Jess,10.124,False
13925035477,app_store,nl,2026-04-05T05:42:14-07:00,5,Konts,Nu labs,valdeens12,10.124,False
